01:23:08.921480 e0:06:e6:d0:32:cb > 00:1a:3f:d6:50:20, ethertype IPv4 (0x0800), length 54: 10.0.0.117.53784 > 104.16.13.243.443: Flags [.], ack 976770806, win 309, length 0
01:23:08.921524 e0:06:e6:d0:32:cb > 00:1a:3f:d6:50:20, ethertype IPv4 (0x0800), length 54: 10.0.0.117.53786 > 104.16.13.243.443: Flags [.], ack 2761514685, win 343, length 0
01:23:08.921562 e0:06:e6:d0:32:cb > 00:1a:3f:d6:50:20, ethertype IPv4 (0x0800), length 54: 10.0.0.117.53068 > 104.25.81.110.443: Flags [.], ack 4267239122, win 343, length 0
01:23:10.457459 e0:06:e6:d0:32:cb > ac:1f:74:83:7f:3f, ethertype ARP (0x0806), length 42: Request who-has 10.0.0.118 tell 10.0.0.117, length 28
01:23:10.462835 ac:1f:74:83:7f:3f > e0:06:e6:d0:32:cb, ethertype ARP (0x0806), length 42: Reply 10.0.0.118 is-at ac:1f:74:83:7f:3f, length 28
01:23:10.478131 00:1a:3f:d6:50:20 > e0:06:e6:d0:32:cb, ethertype ARP (0x0806), length 42: Request who-has 10.0.0.117 tell 10.0.0.100, length 28
01:23:10.478160 e0:06:e6:d0:32:cb > 00:1a:3f:d6:50:20, ethertype ARP (0x0806), length 42: Reply 10.0.0.117 is-at e0:06:e6:d0:32:cb, length 28
01:23:10.969478 e0:06:e6:d0:32:cb > 00:1a:3f:d6:50:20, ethertype IPv4 (0x0800), length 54: 10.0.0.117.53070 > 104.25.81.110.443: Flags [.], ack 445862252, win 320, length 0
01:23:15.065500 e0:06:e6:d0:32:cb > 00:1a:3f:d6:50:20, ethertype IPv4 (0x0800), length 66: 10.0.0.117.43044 > 37.228.108.132.443: Flags [.], ack 1173458702, win 245, options [nop,nop,TS val 1109089188 ecr 2375100493], length 0
01:23:15.065552 e0:06:e6:d0:32:cb > 00:1a:3f:d6:50:20, ethertype IPv4 (0x0800), length 66: 10.0.0.117.37200 > 151.101.64.134.443: Flags [.], ack 2217046664, win 319, options [nop,nop,TS val 1985570807 ecr 733375754], length 0
01:23:15.115464 00:1a:3f:d6:50:20 > e0:06:e6:d0:32:cb, ethertype IPv4 (0x0800), length 66: 151.101.64.134.443 > 10.0.0.117.37200: Flags [.], ack 1, win 59, options [nop,nop,TS val 733387023 ecr 1985164498], length 0
01:23:16.296676 00:1a:3f:d6:50:20 > 01:00:5e:7f:ff:fa, ethertype IPv4 (0x0800), length 310: 10.0.0.100.1024 > 239.255.255.250.1900: UDP, length 268
01:23:16.300291 00:1a:3f:d6:50:20 > 01:00:5e:7f:ff:fa, ethertype IPv4 (0x0800), length 382: 10.0.0.100.1024 > 239.255.255.250.1900: UDP, length 340
01:23:16.304154 00:1a:3f:d6:50:20 > 01:00:5e:7f:ff:fa, ethertype IPv4 (0x0800), length 378: 10.0.0.100.1024 > 239.255.255.250.1900: UDP, length 336
01:23:16.307581 00:1a:3f:d6:50:20 > 01:00:5e:7f:ff:fa, ethertype IPv4 (0x0800), length 358: 10.0.0.100.1024 > 239.255.255.250.1900: UDP, length 316
01:23:16.311307 00:1a:3f:d6:50:20 > 01:00:5e:7f:ff:fa, ethertype IPv4 (0x0800), length 390: 10.0.0.100.1024 > 239.255.255.250.1900: UDP, length 348
01:23:16.314829 00:1a:3f:d6:50:20 > 01:00:5e:7f:ff:fa, ethertype IPv4 (0x0800), length 372: 10.0.0.100.1024 > 239.255.255.250.1900: UDP, length 330
01:23:16.318354 00:1a:3f:d6:50:20 > 01:00:5e:7f:ff:fa, ethertype IPv4 (0x0800), length 374: 10.0.0.100.1024 > 239.255.255.250.1900: UDP, length 332
01:23:16.322080 00:1a:3f:d6:50:20 > 01:00:5e:7f:ff:fa, ethertype IPv4 (0x0800), length 374: 10.0.0.100.1024 > 239.255.255.250.1900: UDP, length 332
01:23:17.113482 e0:06:e6:d0:32:cb > 00:1a:3f:d6:50:20, ethertype IPv4 (0x0800), length 66: 10.0.0.117.37232 > 151.101.64.134.443: Flags [.], ack 1508946141, win 237, options [nop,nop,TS val 1985572852 ecr 730411611], length 0
01:23:17.113529 e0:06:e6:d0:32:cb > 00:1a:3f:d6:50:20, ethertype IPv4 (0x0800), length 66: 10.0.0.117.37234 > 151.101.64.134.443: Flags [.], ack 2521420961, win 237, options [nop,nop,TS val 1985572853 ecr 391067851], length 0
01:23:17.113561 e0:06:e6:d0:32:cb > 00:1a:3f:d6:50:20, ethertype IPv4 (0x0800), length 66: 10.0.0.117.37230 > 151.101.64.134.443: Flags [.], ack 979775261, win 237, options [nop,nop,TS val 1985572850 ecr 603665337], length 0
